{
  "$comment": "Code generated by tools/ci generate. DO NOT EDIT.\nSource: tools/schemagen (the Go type github.com/brunovenceslau/romeu-e-julieta/internal/manifest.Manifest)\n\nGenerated by this command:\n\n\tgo generate ./...\n",
  "$schema": "https://json-schema.org/draft/2020-12/schema",
  "additionalProperties": false,
  "properties": {
    "agent": {
      "type": "string"
    },
    "egress": {
      "items": {
        "type": "string"
      },
      "type": "array"
    },
    "generation": {
      "type": "string"
    },
    "project": {
      "type": "string"
    },
    "protocol": {
      "type": "integer"
    },
    "repos": {
      "items": {
        "additionalProperties": false,
        "properties": {
          "base": {
            "items": {
              "type": "string"
            },
            "type": "array"
          },
          "dir": {
            "type": "string"
          },
          "memory": {
            "type": "string"
          },
          "path": {
            "type": "string"
          },
          "primary": {
            "type": "boolean"
          },
          "ref": {
            "type": "string"
          },
          "url": {
            "type": "string"
          }
        },
        "required": [
          "base",
          "dir",
          "memory",
          "path",
          "primary",
          "ref",
          "url"
        ],
        "type": "object"
      },
      "type": "array"
    },
    "run": {
      "additionalProperties": {},
      "type": "object"
    },
    "runDigest": {
      "type": "string"
    },
    "salvage": {
      "additionalProperties": false,
      "properties": {
        "capBytes": {
          "type": "integer"
        },
        "excludeIgnored": {
          "items": {
            "type": "string"
          },
          "type": "array"
        }
      },
      "required": [
        "capBytes",
        "excludeIgnored"
      ],
      "type": "object"
    },
    "salvageRun": {
      "additionalProperties": false,
      "properties": {
        "id": {
          "type": "string"
        }
      },
      "required": [
        "id"
      ],
      "type": "object"
    },
    "schema": {
      "const": "manifest/v1",
      "type": "string"
    },
    "specCommit": {
      "type": "string"
    }
  },
  "required": [
    "agent",
    "egress",
    "generation",
    "project",
    "protocol",
    "repos",
    "run",
    "runDigest",
    "salvage",
    "schema",
    "specCommit"
  ],
  "title": "manifest.v1",
  "type": "object"
}
