{"agent":"sbx-kit-claude","egress":["dl.google.com","github.com"],"generation":"01j9zc2q8x7w4t6y3r5e1v9k0p","project":"shop","protocol":1,"repos":[{"base":["89abcdef0123456789abcdef0123456789abcdef"],"dir":"shop-api","memory":"/abs/root/shop-env/memory/shop-api","path":"/abs/root/shop-env/shop-api","primary":true,"ref":"main","url":"https://github.com/example/shop-api"},{"base":[],"dir":"shop-web","memory":"/abs/root/shop-env/memory/shop-web","path":"/home/agent/src/shop/shop-web","primary":false,"ref":"main","url":"https://github.com/example/shop-web"}],"run":{"panes":[{"cwd":".","env":{"PORT":"8080"},"focus":true,"id":"api","repo":"shop-api","steps":[["go","run","."]]},{"cwd":".","env":{},"focus":false,"id":"web","repo":"shop-web","steps":[]}],"tabs":[{"label":"dev","root":{"first":{"pane":"api"},"ratio":0.5,"second":{"pane":"web"},"split":"row"}}]},"runDigest":"fedcba9876543210fedcba9876543210fedcba9876543210fedcba9876543210","salvage":{"capBytes":1073741824,"excludeIgnored":["node_modules/",".venv/","target/"]},"salvageRun":{"id":"01j9zd0a1b2c3d4e5f6g7h8j9k"},"schema":"manifest/v1","specCommit":"0123456789abcdef0123456789abcdef01234567"}